{
  "id": "pop-dpat-00",
  "codigo": "DPAT-00",
  "titulo": "Visão geral — Div. de Patrimônio e Equipamentos",
  "setor": "Div. de Patrimônio e Equipamentos",
  "setor_codigo": "S03.05-DPAT",
  "sigla": "DPAT",
  "versao": "0.2.1",
  "status": "rascunho",
  "ddd": {
    "divisao": "Secretaria Administrativa",
    "departamento": "Div. de Patrimônio e Equipamentos",
    "descricao": "Divisão de Patrimônio e Equipamentos da Secretaria Administrativa. Playbook em construção (tombamento, controle e desfazimento de bens).",
    "dominio": "Suprimentos e Materiais",
    "subdominio": "Visão geral do setor (playbook)",
    "tipo_subdominio": "core",
    "contexto": "S03.05-DPAT",
    "glossario": []
  },
  "identificacao": {
    "responsavel": "A definir",
    "periodicidade": "A definir",
    "normativa": [
      "A definir (normas de patrimônio; TCE-PR)"
    ],
    "subordinacao": "Secretaria Administrativa",
    "produto_atdg": "POP",
    "pasta_onedrive": "03_MAPEAMENTO DE PROCESSOS"
  },
  "organograma_mermaid": "graph TD\n  S01_DG[\"S01-DG<br/>Direção Geral de Campus\"]\n  S03_SADM[\"S03-SADM<br/>Secretaria Administrativa\"]\n  S01_DG --> S03_SADM\n  S03_05_DPAT[\"S03.05-DPAT<br/>Div. de Patrimônio e Equipamentos\"]\n  S03_SADM --> S03_05_DPAT\n  P[\"DPAT-00<br/>Visão geral — Div. de Patrimônio e Equipamentos\"]\n  S03_05_DPAT --> P\n  classDef setor fill:#EEF0F7,stroke:#1B2747,stroke-width:1.5px,color:#1B2747\n  classDef destaque fill:#FDEAEE,stroke:#CC1544,stroke-width:3px,color:#1B2747\n  classDef vizinho fill:#E0F2F8,stroke:#0B4D66,stroke-width:1.5px,color:#0B4D66\n  class S01_DG,S03_SADM,S03_05_DPAT setor\n  class P destaque",
  "playbook": {
    "gatilho": {
      "evento": "A definir",
      "origem": ""
    },
    "entrada": [],
    "passos": [
      {
        "n": 1,
        "acao": "Levantar as atividades e rotinas da área junto à chefia e aos servidores",
        "responsavel": "A definir",
        "sistema": "e-Protocolo",
        "artefato": "Roteiro de levantamento de atividades",
        "prazo": "A definir",
        "evento": "",
        "fontes": [
          "pb-patrimonio"
        ]
      },
      {
        "n": 2,
        "acao": "Mapear os fluxos e os responsáveis por etapa",
        "responsavel": "A definir",
        "sistema": "planilha",
        "artefato": "Mapa de fluxos e responsáveis",
        "prazo": "A definir",
        "evento": "",
        "fontes": [
          "pb-patrimonio"
        ]
      },
      {
        "n": 3,
        "acao": "Identificar as normas aplicáveis e os pontos de atenção",
        "responsavel": "A definir",
        "sistema": "e-Protocolo",
        "artefato": "Lista de normas e pontos de atenção",
        "prazo": "A definir",
        "evento": "",
        "fontes": [
          "pb-patrimonio"
        ]
      }
    ],
    "saida": []
  },
  "artefatos": [],
  "decisoes": [],
  "pontos_atencao": [
    "Área ainda não mapeada — playbook em construção"
  ],
  "contingencia": [
    "Se a chefia do setor não estiver disponível para o levantamento, agendar nova data e registrar o adiamento",
    "Se não houver documentação prévia da área, iniciar o levantamento por entrevista direta com os servidores",
    "Se forem identificadas normas não catalogadas no Canvas, registrá-las como lacuna para validação posterior",
    "Se o setor não tiver processos definidos, priorizar o mapeamento das atividades de maior volume ou risco (tombamento, controle e desfazimento de bens)"
  ],
  "checklist": [
    "Chefia e servidores do setor entrevistados",
    "Atividades e rotinas da área levantadas",
    "Fluxos e responsáveis por etapa mapeados",
    "Normas aplicáveis identificadas",
    "Pontos de atenção registrados para o próximo ciclo de diagnóstico"
  ],
  "kpis": [],
  "mapa_contexto": [],
  "fluxograma_mermaid": "flowchart LR\n  subgraph R1[\"Div. de Patrimônio e Equipamentos\"]\n    direction LR\n    e1((\"A definir\"))\n    e2[\"Levantar as atividades e rotinas da área junto à chefia e aos servido…\"]\n    e3[\"Mapear os fluxos e os responsáveis por etapa\"]\n    e4[\"Identificar as normas aplicáveis e os pontos de atenção\"]\n    e5(((\"Concluído\")))\n  end\n  e1 --> e2\n  e2 --> e3\n  e3 --> e4\n  e4 --> e5\n  classDef inicio fill:#f3f4f6,stroke:#6b7280,stroke-width:1.5px,color:#374151\n  classDef atividade fill:#E6F7F0,stroke:#0B7A4E,stroke-width:2px,color:#0B7A4E\n  classDef decisao fill:#FFF4ED,stroke:#C9783A,stroke-width:2px,color:#C9783A\n  classDef fim fill:#FDEAEE,stroke:#CC1544,stroke-width:4px,color:#CC1544\n  classDef pausa fill:#FDEAEE,stroke:#CC1544,stroke-width:2px,color:#CC1544\n  classDef captura fill:#E0F2F8,stroke:#0B4D66,stroke-width:2px,color:#0B4D66\n  class e1 inicio\n  class e2,e3,e4 atividade\n  class e5 fim",
  "bpmn_spec": {
    "raias": [
      "Div. de Patrimônio e Equipamentos"
    ],
    "elementos": [
      {
        "id": "e1",
        "tipo": "inicio",
        "label": "A definir",
        "raia": "Div. de Patrimônio e Equipamentos"
      },
      {
        "id": "e2",
        "tipo": "atividade",
        "label": "Levantar as atividades e rotinas da área junto à chefia e aos servidores",
        "raia": "Div. de Patrimônio e Equipamentos"
      },
      {
        "id": "e3",
        "tipo": "atividade",
        "label": "Mapear os fluxos e os responsáveis por etapa",
        "raia": "Div. de Patrimônio e Equipamentos"
      },
      {
        "id": "e4",
        "tipo": "atividade",
        "label": "Identificar as normas aplicáveis e os pontos de atenção",
        "raia": "Div. de Patrimônio e Equipamentos"
      },
      {
        "id": "e5",
        "tipo": "fim",
        "label": "Concluído",
        "raia": "Div. de Patrimônio e Equipamentos"
      }
    ],
    "conexoes": [
      {
        "de": "e1",
        "para": "e2"
      },
      {
        "de": "e2",
        "para": "e3"
      },
      {
        "de": "e3",
        "para": "e4"
      },
      {
        "de": "e4",
        "para": "e5"
      }
    ],
    "observacoes_construcao_miro": "Especificação gerada a partir dos passos do POP; 1 raia(s). Revisar decisões e pausas antes de construir no Miro."
  },
  "changelog": [
    {
      "versao": "0.1.0",
      "data": "2026-09-02",
      "autor": "scripts/scaffold_pops.py",
      "tipo": "patch",
      "mudancas": [
        "Esqueleto inicial gerado deterministicamente a partir das entradas pb-patrimonio"
      ],
      "fontes": [
        "pb-patrimonio"
      ],
      "motivo": "Scaffold do piloto (todos os setores do organograma)"
    },
    {
      "versao": "0.2.0",
      "data": "2026-09-03",
      "autor": "agente:construtor-pop (lote C)",
      "tipo": "minor",
      "mudancas": [
        "Passo 1 alterado (acao, responsavel, sistema, artefato, prazo, evento, fontes)",
        "Passo 2 alterado (acao, responsavel, sistema, artefato, prazo, evento, fontes)",
        "Passo 3 alterado (acao, responsavel, sistema, artefato, prazo, evento, fontes)",
        "contingencia_nova: +4",
        "checklist_novo: +5",
        "Campo observacoes atualizado",
        "Fluxograma regenerado a partir dos passos"
      ],
      "fontes": [
        "pb-patrimonio"
      ],
      "motivo": "Estruturação do roteiro de coleta para a Div. de Patrimônio e Equipamentos: setor ainda sem entradas específicas no Canvas além do playbook-esqueleto genérico; os 3 passos existentes recebem sistema/artefato e o POP passa a orientar a coleta de evidências, sem promover o status."
    },
    {
      "versao": "0.2.1",
      "data": "2026-09-03",
      "autor": "agente:curador-diretrizes",
      "tipo": "patch",
      "mudancas": [
        "Campo identificacao.normativa atualizado"
      ],
      "fontes": [],
      "motivo": "Correção da normativa quebrada pelo separador ';' dentro de parênteses no esqueleto (achado do lote C)."
    }
  ],
  "validacao": {
    "elaboracao": "ATDG — Assessoria Técnica da Direção Geral",
    "revisao": "A definir (responsável do setor)",
    "aprovacao": "Direção Geral do Campus",
    "data_aprovacao": ""
  },
  "licoes_aplicadas": [
    "L-001",
    "L-004",
    "L-006",
    "L-007",
    "L-002",
    "L-003",
    "L-005"
  ],
  "lacunas": [
    "responsavel",
    "gatilho",
    "entrada",
    "saida",
    "kpi",
    "contingencia",
    "formulario",
    "prazo"
  ],
  "observacoes": "Setor ainda não mapeado — roteiro de coleta",
  "fontes_entradas": [
    "pb-patrimonio"
  ],
  "hash_fontes": "4aaf5aa16ed9373c1b9e5ebd545b504823bb5bd22632687ced3264b79196242c",
  "agente": "pop-dpat-00",
  "versao_diretrizes": "1.8",
  "criado_em": "2026-09-02T17:55:54Z",
  "atualizado_em": "2026-09-03T02:05:26Z"
}
