{
  "id": "pop-ces-00",
  "codigo": "CES-00",
  "titulo": "Visão geral — Centro de Educação e Saúde (novo abr/2026) — Direção de Centro",
  "setor": "CES — Direção de Centro",
  "setor_codigo": "S10-CES",
  "sigla": "CES",
  "versao": "0.1.0",
  "status": "rascunho",
  "ddd": {
    "divisao": "Centro de Educação e Saúde (novo abr/2026) — Direção de Centro",
    "departamento": "Centro de Educação e Saúde (novo abr/2026) — Direção de Centro",
    "descricao": "Visão do Centro (novo abr/2026): colegiado de Enfermagem (incl. PRONERA) e mestrados em Ensino, Saúde Pública em Região de Fronteira e Sociedade, Cultura e Fronteiras.",
    "dominio": "Ensino, Pesquisa e Extensão (Centro)",
    "subdominio": "Visão geral do setor (playbook)",
    "tipo_subdominio": "core",
    "contexto": "S10-CES",
    "glossario": []
  },
  "identificacao": {
    "responsavel": "A definir",
    "periodicidade": "A definir",
    "normativa": [
      "Estatuto (Res. 017/99-COU e 194/2024-COU) art. 37 e 41"
    ],
    "subordinacao": "Direção Geral de Campus",
    "produto_atdg": "POP",
    "pasta_onedrive": "03_MAPEAMENTO DE PROCESSOS"
  },
  "organograma_mermaid": "graph TD\n  S01_DG[\"S01-DG<br/>Direção Geral de Campus\"]\n  S10_CES[\"S10-CES<br/>Centro de Educação e Saúde (novo abr/2026) — Direção de Cen…\"]\n  S01_DG --> S10_CES\n  P[\"CES-00<br/>Visão geral — Centro de Educação e Saúde (novo abr/2026) —…\"]\n  S10_CES --> P\n  classDef setor fill:#EEF0F7,stroke:#1B2747,stroke-width:1.5px,color:#1B2747\n  classDef destaque fill:#FDEAEE,stroke:#CC1544,stroke-width:3px,color:#1B2747\n  classDef vizinho fill:#E0F2F8,stroke:#0B4D66,stroke-width:1.5px,color:#0B4D66\n  class S01_DG,S10_CES setor\n  class P destaque",
  "playbook": {
    "gatilho": {
      "evento": "A definir",
      "origem": ""
    },
    "entrada": [],
    "passos": [
      {
        "n": 1,
        "acao": "Articular Direção de Centro, colegiados e coordenações",
        "responsavel": "A definir",
        "sistema": "",
        "artefato": "",
        "prazo": "A definir",
        "evento": "",
        "fontes": [
          "pb-ces"
        ]
      },
      {
        "n": 2,
        "acao": "Manter a base de contatos por função do Centro",
        "responsavel": "A definir",
        "sistema": "",
        "artefato": "",
        "prazo": "A definir",
        "evento": "",
        "fontes": [
          "pb-ces"
        ]
      },
      {
        "n": 3,
        "acao": "Encaminhar demandas do Centro via e-Protocolo",
        "responsavel": "A definir",
        "sistema": "",
        "artefato": "",
        "prazo": "A definir",
        "evento": "",
        "fontes": [
          "pb-ces"
        ]
      }
    ],
    "saida": []
  },
  "artefatos": [],
  "decisoes": [],
  "pontos_atencao": [
    "Centro novo (abr/2026) — consolidar estrutura e contatos",
    "Originado do desdobramento do antigo CELS"
  ],
  "contingencia": [],
  "checklist": [],
  "kpis": [],
  "mapa_contexto": [],
  "fluxograma_mermaid": "flowchart LR\n  subgraph R1[\"CES — Direção de Centro\"]\n    direction LR\n    e1((\"A definir\"))\n    e2[\"Articular Direção de Centro, colegiados e coordenações\"]\n    e3[\"Manter a base de contatos por função do Centro\"]\n    e4[\"Encaminhar demandas do Centro via e-Protocolo\"]\n    e5(((\"Concluído\")))\n  end\n  e1 --> e2\n  e2 --> e3\n  e3 --> e4\n  e4 --> e5\n  classDef inicio fill:#f3f4f6,stroke:#6b7280,stroke-width:1.5px,color:#374151\n  classDef atividade fill:#E6F7F0,stroke:#0B7A4E,stroke-width:2px,color:#0B7A4E\n  classDef decisao fill:#FFF4ED,stroke:#C9783A,stroke-width:2px,color:#C9783A\n  classDef fim fill:#FDEAEE,stroke:#CC1544,stroke-width:4px,color:#CC1544\n  classDef pausa fill:#FDEAEE,stroke:#CC1544,stroke-width:2px,color:#CC1544\n  classDef captura fill:#E0F2F8,stroke:#0B4D66,stroke-width:2px,color:#0B4D66\n  class e1 inicio\n  class e2,e3,e4 atividade\n  class e5 fim",
  "bpmn_spec": {
    "raias": [
      "CES — Direção de Centro"
    ],
    "elementos": [
      {
        "id": "e1",
        "tipo": "inicio",
        "label": "A definir",
        "raia": "CES — Direção de Centro"
      },
      {
        "id": "e2",
        "tipo": "atividade",
        "label": "Articular Direção de Centro, colegiados e coordenações",
        "raia": "CES — Direção de Centro"
      },
      {
        "id": "e3",
        "tipo": "atividade",
        "label": "Manter a base de contatos por função do Centro",
        "raia": "CES — Direção de Centro"
      },
      {
        "id": "e4",
        "tipo": "atividade",
        "label": "Encaminhar demandas do Centro via e-Protocolo",
        "raia": "CES — Direção de Centro"
      },
      {
        "id": "e5",
        "tipo": "fim",
        "label": "Concluído",
        "raia": "CES — Direção de Centro"
      }
    ],
    "conexoes": [
      {
        "de": "e1",
        "para": "e2"
      },
      {
        "de": "e2",
        "para": "e3"
      },
      {
        "de": "e3",
        "para": "e4"
      },
      {
        "de": "e4",
        "para": "e5"
      }
    ],
    "observacoes_construcao_miro": "Especificação gerada a partir dos passos do POP; 1 raia(s). Revisar decisões e pausas antes de construir no Miro."
  },
  "changelog": [
    {
      "versao": "0.1.0",
      "data": "2026-09-02",
      "autor": "scripts/scaffold_pops.py",
      "tipo": "patch",
      "mudancas": [
        "Esqueleto inicial gerado deterministicamente a partir das entradas pb-ces"
      ],
      "fontes": [
        "pb-ces"
      ],
      "motivo": "Scaffold do piloto (todos os setores do organograma)"
    }
  ],
  "validacao": {
    "elaboracao": "ATDG — Assessoria Técnica da Direção Geral",
    "revisao": "A definir (responsável do setor)",
    "aprovacao": "Direção Geral do Campus",
    "data_aprovacao": ""
  },
  "licoes_aplicadas": [
    "L-001",
    "L-004",
    "L-006",
    "L-007"
  ],
  "lacunas": [
    "responsavel",
    "gatilho",
    "entrada",
    "saida",
    "kpi",
    "contingencia",
    "formulario",
    "prazo"
  ],
  "observacoes": "",
  "fontes_entradas": [
    "pb-ces"
  ],
  "hash_fontes": "49969bbb786f4d16c98fec02373400385b78c36289a3471b0f7ca36d8c2f855a",
  "agente": "",
  "versao_diretrizes": "1.0",
  "criado_em": "2026-09-02T17:55:55Z",
  "atualizado_em": "2026-09-02T17:55:55Z"
}
