{
  "id": "pop-cacad-01",
  "codigo": "CACAD-01",
  "titulo": "Fluxos e-Protocolo — Extensão (PROEX)",
  "setor": "Coordenação Acadêmica — Geral",
  "setor_codigo": "S05-CACAD",
  "sigla": "CACAD",
  "versao": "0.1.0",
  "status": "rascunho",
  "ddd": {
    "divisao": "Coordenação Acadêmica",
    "departamento": "Coordenação Acadêmica",
    "descricao": "Manual da Comissão e-Protocolo com os fluxos da área de Extensão (PROEX). Detalha a abertura de novas atividades de extensão (programas, projetos, cursos e eventos) com e sem recursos financeiros, propostas por docente ou agente universitário, e atividades com fomento externo. Orienta a tramitação correta de cada modalidade no e-Protocolo.",
    "dominio": "Gestão Acadêmica",
    "subdominio": "Fluxos e-Protocolo — Extensão (PROEX)",
    "tipo_subdominio": "core",
    "contexto": "S05-CACAD",
    "glossario": []
  },
  "identificacao": {
    "responsavel": "A definir",
    "periodicidade": "A definir",
    "normativa": [
      "Manual de Fluxos e-Protocolo — PROEX/Unioeste"
    ],
    "subordinacao": "Direção Geral de Campus",
    "produto_atdg": "POP",
    "pasta_onedrive": "03_MAPEAMENTO DE PROCESSOS"
  },
  "organograma_mermaid": "graph TD\n  S01_DG[\"S01-DG<br/>Direção Geral de Campus\"]\n  S05_CACAD[\"S05-CACAD<br/>Coordenação Acadêmica\"]\n  S01_DG --> S05_CACAD\n  P[\"CACAD-01<br/>Fluxos e-Protocolo — Extensão (PROEX)\"]\n  S05_CACAD --> P\n  classDef setor fill:#EEF0F7,stroke:#1B2747,stroke-width:1.5px,color:#1B2747\n  classDef destaque fill:#FDEAEE,stroke:#CC1544,stroke-width:3px,color:#1B2747\n  classDef vizinho fill:#E0F2F8,stroke:#0B4D66,stroke-width:1.5px,color:#0B4D66\n  class S01_DG,S05_CACAD setor\n  class P destaque",
  "playbook": {
    "gatilho": {
      "evento": "A definir",
      "origem": ""
    },
    "entrada": [],
    "passos": [
      {
        "n": 1,
        "acao": "Classificar a atividade de extensão (com/sem recursos; proponente)",
        "responsavel": "A definir",
        "sistema": "",
        "artefato": "",
        "prazo": "A definir",
        "evento": "",
        "fontes": [
          "1780963200039"
        ]
      },
      {
        "n": 2,
        "acao": "Abrir o e-Protocolo conforme o fluxo da modalidade",
        "responsavel": "A definir",
        "sistema": "",
        "artefato": "",
        "prazo": "A definir",
        "evento": "",
        "fontes": [
          "1780963200039"
        ]
      },
      {
        "n": 3,
        "acao": "Anexar documentação e encaminhar às instâncias previstas",
        "responsavel": "A definir",
        "sistema": "",
        "artefato": "",
        "prazo": "A definir",
        "evento": "",
        "fontes": [
          "1780963200039"
        ]
      },
      {
        "n": 4,
        "acao": "Acompanhar aprovação na PROEX",
        "responsavel": "A definir",
        "sistema": "",
        "artefato": "",
        "prazo": "A definir",
        "evento": "",
        "fontes": [
          "1780963200039"
        ]
      }
    ],
    "saida": []
  },
  "artefatos": [],
  "decisoes": [],
  "pontos_atencao": [
    "Distinguir corretamente atividades com e sem recursos financeiros",
    "Atividades com fomento externo têm fluxo próprio"
  ],
  "contingencia": [],
  "checklist": [],
  "kpis": [],
  "mapa_contexto": [],
  "fluxograma_mermaid": "flowchart LR\n  subgraph R1[\"Coordenação Acadêmica — Geral\"]\n    direction LR\n    e1((\"A definir\"))\n    e2[\"Classificar a atividade de extensão (com/sem recursos; proponente)\"]\n    e3[\"Abrir o e-Protocolo conforme o fluxo da modalidade\"]\n    e4[\"Anexar documentação e encaminhar às instâncias previstas\"]\n    e5[\"Acompanhar aprovação na PROEX\"]\n    e6(((\"Concluído\")))\n  end\n  e1 --> e2\n  e2 --> e3\n  e3 --> e4\n  e4 --> e5\n  e5 --> e6\n  classDef inicio fill:#f3f4f6,stroke:#6b7280,stroke-width:1.5px,color:#374151\n  classDef atividade fill:#E6F7F0,stroke:#0B7A4E,stroke-width:2px,color:#0B7A4E\n  classDef decisao fill:#FFF4ED,stroke:#C9783A,stroke-width:2px,color:#C9783A\n  classDef fim fill:#FDEAEE,stroke:#CC1544,stroke-width:4px,color:#CC1544\n  classDef pausa fill:#FDEAEE,stroke:#CC1544,stroke-width:2px,color:#CC1544\n  classDef captura fill:#E0F2F8,stroke:#0B4D66,stroke-width:2px,color:#0B4D66\n  class e1 inicio\n  class e2,e3,e4,e5 atividade\n  class e6 fim",
  "bpmn_spec": {
    "raias": [
      "Coordenação Acadêmica — Geral"
    ],
    "elementos": [
      {
        "id": "e1",
        "tipo": "inicio",
        "label": "A definir",
        "raia": "Coordenação Acadêmica — Geral"
      },
      {
        "id": "e2",
        "tipo": "atividade",
        "label": "Classificar a atividade de extensão (com/sem recursos; proponente)",
        "raia": "Coordenação Acadêmica — Geral"
      },
      {
        "id": "e3",
        "tipo": "atividade",
        "label": "Abrir o e-Protocolo conforme o fluxo da modalidade",
        "raia": "Coordenação Acadêmica — Geral"
      },
      {
        "id": "e4",
        "tipo": "atividade",
        "label": "Anexar documentação e encaminhar às instâncias previstas",
        "raia": "Coordenação Acadêmica — Geral"
      },
      {
        "id": "e5",
        "tipo": "atividade",
        "label": "Acompanhar aprovação na PROEX",
        "raia": "Coordenação Acadêmica — Geral"
      },
      {
        "id": "e6",
        "tipo": "fim",
        "label": "Concluído",
        "raia": "Coordenação Acadêmica — Geral"
      }
    ],
    "conexoes": [
      {
        "de": "e1",
        "para": "e2"
      },
      {
        "de": "e2",
        "para": "e3"
      },
      {
        "de": "e3",
        "para": "e4"
      },
      {
        "de": "e4",
        "para": "e5"
      },
      {
        "de": "e5",
        "para": "e6"
      }
    ],
    "observacoes_construcao_miro": "Especificação gerada a partir dos passos do POP; 1 raia(s). Revisar decisões e pausas antes de construir no Miro."
  },
  "changelog": [
    {
      "versao": "0.1.0",
      "data": "2026-09-02",
      "autor": "scripts/scaffold_pops.py",
      "tipo": "patch",
      "mudancas": [
        "Esqueleto inicial gerado deterministicamente a partir das entradas 1780963200039"
      ],
      "fontes": [
        "1780963200039"
      ],
      "motivo": "Scaffold do piloto (todos os setores do organograma)"
    }
  ],
  "validacao": {
    "elaboracao": "ATDG — Assessoria Técnica da Direção Geral",
    "revisao": "A definir (responsável do setor)",
    "aprovacao": "Direção Geral do Campus",
    "data_aprovacao": ""
  },
  "licoes_aplicadas": [
    "L-001",
    "L-004",
    "L-006",
    "L-007"
  ],
  "lacunas": [
    "responsavel",
    "gatilho",
    "entrada",
    "saida",
    "kpi",
    "contingencia",
    "formulario",
    "prazo"
  ],
  "observacoes": "",
  "fontes_entradas": [
    "1780963200039"
  ],
  "hash_fontes": "7e528d3379c8b610c05e847f74ee03d4cba5d4c43d71d4b8ac85bcecb2a35b0d",
  "agente": "",
  "versao_diretrizes": "1.0",
  "criado_em": "2026-09-02T17:55:54Z",
  "atualizado_em": "2026-09-02T17:55:54Z"
}
