{
  "id": "pop-dcom-01",
  "codigo": "DCOM-01",
  "titulo": "Fluxo — Dispensa Emergencial (com Contrato)",
  "setor": "Div. de Compras",
  "setor_codigo": "S03.10-DCOM",
  "sigla": "DCOM",
  "versao": "0.1.0",
  "status": "rascunho",
  "ddd": {
    "divisao": "Secretaria Administrativa",
    "departamento": "Div. de Compras",
    "descricao": "Fluxo da contratação por dispensa emergencial com contrato. O interessado elabora termo de referência, cotações e tabela comparativa e envia ao Planejamento, que analisa e submete à autorização da Direção Geral. Compras faz pesquisa de preços e checa regularidade fiscal; o Jurídico emite parecer; o Financeiro empenha; a Licitação elabora o contrato, que é assinado, publicado no DIOE e tem portarias de gestor/fiscal emitidas pela Direção Geral.",
    "dominio": "Contratações Públicas",
    "subdominio": "Fluxo — Dispensa Emergencial (com Contrato)",
    "tipo_subdominio": "core",
    "contexto": "S03.10-DCOM",
    "glossario": []
  },
  "identificacao": {
    "responsavel": "A definir",
    "periodicidade": "A definir",
    "normativa": [
      "Lei nº 14.133/2021 (Licitações e Contratos)",
      "normas internas Unioeste"
    ],
    "subordinacao": "Secretaria Administrativa",
    "produto_atdg": "POP",
    "pasta_onedrive": "03_MAPEAMENTO DE PROCESSOS"
  },
  "organograma_mermaid": "graph TD\n  S01_DG[\"S01-DG<br/>Direção Geral de Campus\"]\n  S03_SADM[\"S03-SADM<br/>Secretaria Administrativa\"]\n  S01_DG --> S03_SADM\n  S03_10_DCOM[\"S03.10-DCOM<br/>Div. de Compras\"]\n  S03_SADM --> S03_10_DCOM\n  P[\"DCOM-01<br/>Fluxo — Dispensa Emergencial (com Contrato)\"]\n  S03_10_DCOM --> P\n  classDef setor fill:#EEF0F7,stroke:#1B2747,stroke-width:1.5px,color:#1B2747\n  classDef destaque fill:#FDEAEE,stroke:#CC1544,stroke-width:3px,color:#1B2747\n  classDef vizinho fill:#E0F2F8,stroke:#0B4D66,stroke-width:1.5px,color:#0B4D66\n  class S01_DG,S03_SADM,S03_10_DCOM setor\n  class P destaque",
  "playbook": {
    "gatilho": {
      "evento": "A definir",
      "origem": ""
    },
    "entrada": [],
    "passos": [
      {
        "n": 1,
        "acao": "Interessado elabora termo de referência, cotações e tabela comparativa",
        "responsavel": "A definir",
        "sistema": "",
        "artefato": "",
        "prazo": "A definir",
        "evento": "",
        "fontes": [
          "1780963200050"
        ]
      },
      {
        "n": 2,
        "acao": "Planejamento analisa e submete à autorização da Direção Geral",
        "responsavel": "A definir",
        "sistema": "",
        "artefato": "",
        "prazo": "A definir",
        "evento": "",
        "fontes": [
          "1780963200050"
        ]
      },
      {
        "n": 3,
        "acao": "Compras faz pesquisa de preços e verifica regularidade fiscal",
        "responsavel": "A definir",
        "sistema": "",
        "artefato": "",
        "prazo": "A definir",
        "evento": "",
        "fontes": [
          "1780963200050"
        ]
      },
      {
        "n": 4,
        "acao": "Jurídico emite parecer; Financeiro faz o empenho no GMS",
        "responsavel": "A definir",
        "sistema": "",
        "artefato": "",
        "prazo": "A definir",
        "evento": "",
        "fontes": [
          "1780963200050"
        ]
      },
      {
        "n": 5,
        "acao": "Licitação elabora o contrato; assina-se e publica-se no DIOE",
        "responsavel": "A definir",
        "sistema": "",
        "artefato": "",
        "prazo": "A definir",
        "evento": "",
        "fontes": [
          "1780963200050"
        ]
      },
      {
        "n": 6,
        "acao": "Direção Geral emite portarias de Gestor e Fiscal",
        "responsavel": "A definir",
        "sistema": "",
        "artefato": "",
        "prazo": "A definir",
        "evento": "",
        "fontes": [
          "1780963200050"
        ]
      }
    ],
    "saida": []
  },
  "artefatos": [],
  "decisoes": [],
  "pontos_atencao": [
    "Dispensa emergencial exige justificativa da urgência",
    "Verificar regularidade fiscal antes do empenho",
    "Publicação no DIOE é condição de eficácia"
  ],
  "contingencia": [],
  "checklist": [],
  "kpis": [],
  "mapa_contexto": [],
  "fluxograma_mermaid": "flowchart LR\n  subgraph R1[\"Div. de Compras\"]\n    direction LR\n    e1((\"A definir\"))\n    e2[\"Interessado elabora termo de referência, cotações e tabela comparativa\"]\n    e3[\"Planejamento analisa e submete à autorização da Direção Geral\"]\n    e4[\"Compras faz pesquisa de preços e verifica regularidade fiscal\"]\n    e5[\"Jurídico emite parecer; Financeiro faz o empenho no GMS\"]\n    e6[\"Licitação elabora o contrato; assina-se e publica-se no DIOE\"]\n    e7[\"Direção Geral emite portarias de Gestor e Fiscal\"]\n    e8(((\"Concluído\")))\n  end\n  e1 --> e2\n  e2 --> e3\n  e3 --> e4\n  e4 --> e5\n  e5 --> e6\n  e6 --> e7\n  e7 --> e8\n  classDef inicio fill:#f3f4f6,stroke:#6b7280,stroke-width:1.5px,color:#374151\n  classDef atividade fill:#E6F7F0,stroke:#0B7A4E,stroke-width:2px,color:#0B7A4E\n  classDef decisao fill:#FFF4ED,stroke:#C9783A,stroke-width:2px,color:#C9783A\n  classDef fim fill:#FDEAEE,stroke:#CC1544,stroke-width:4px,color:#CC1544\n  classDef pausa fill:#FDEAEE,stroke:#CC1544,stroke-width:2px,color:#CC1544\n  classDef captura fill:#E0F2F8,stroke:#0B4D66,stroke-width:2px,color:#0B4D66\n  class e1 inicio\n  class e2,e3,e4,e5,e6,e7 atividade\n  class e8 fim",
  "bpmn_spec": {
    "raias": [
      "Div. de Compras"
    ],
    "elementos": [
      {
        "id": "e1",
        "tipo": "inicio",
        "label": "A definir",
        "raia": "Div. de Compras"
      },
      {
        "id": "e2",
        "tipo": "atividade",
        "label": "Interessado elabora termo de referência, cotações e tabela comparativa",
        "raia": "Div. de Compras"
      },
      {
        "id": "e3",
        "tipo": "atividade",
        "label": "Planejamento analisa e submete à autorização da Direção Geral",
        "raia": "Div. de Compras"
      },
      {
        "id": "e4",
        "tipo": "atividade",
        "label": "Compras faz pesquisa de preços e verifica regularidade fiscal",
        "raia": "Div. de Compras"
      },
      {
        "id": "e5",
        "tipo": "atividade",
        "label": "Jurídico emite parecer; Financeiro faz o empenho no GMS",
        "raia": "Div. de Compras"
      },
      {
        "id": "e6",
        "tipo": "atividade",
        "label": "Licitação elabora o contrato; assina-se e publica-se no DIOE",
        "raia": "Div. de Compras"
      },
      {
        "id": "e7",
        "tipo": "atividade",
        "label": "Direção Geral emite portarias de Gestor e Fiscal",
        "raia": "Div. de Compras"
      },
      {
        "id": "e8",
        "tipo": "fim",
        "label": "Concluído",
        "raia": "Div. de Compras"
      }
    ],
    "conexoes": [
      {
        "de": "e1",
        "para": "e2"
      },
      {
        "de": "e2",
        "para": "e3"
      },
      {
        "de": "e3",
        "para": "e4"
      },
      {
        "de": "e4",
        "para": "e5"
      },
      {
        "de": "e5",
        "para": "e6"
      },
      {
        "de": "e6",
        "para": "e7"
      },
      {
        "de": "e7",
        "para": "e8"
      }
    ],
    "observacoes_construcao_miro": "Especificação gerada a partir dos passos do POP; 1 raia(s). Revisar decisões e pausas antes de construir no Miro."
  },
  "changelog": [
    {
      "versao": "0.1.0",
      "data": "2026-09-02",
      "autor": "scripts/scaffold_pops.py",
      "tipo": "patch",
      "mudancas": [
        "Esqueleto inicial gerado deterministicamente a partir das entradas 1780963200050"
      ],
      "fontes": [
        "1780963200050"
      ],
      "motivo": "Scaffold do piloto (todos os setores do organograma)"
    }
  ],
  "validacao": {
    "elaboracao": "ATDG — Assessoria Técnica da Direção Geral",
    "revisao": "A definir (responsável do setor)",
    "aprovacao": "Direção Geral do Campus",
    "data_aprovacao": ""
  },
  "licoes_aplicadas": [
    "L-001",
    "L-004",
    "L-006",
    "L-007"
  ],
  "lacunas": [
    "responsavel",
    "gatilho",
    "entrada",
    "saida",
    "kpi",
    "contingencia",
    "formulario",
    "prazo"
  ],
  "observacoes": "",
  "fontes_entradas": [
    "1780963200050"
  ],
  "hash_fontes": "0c5749c479f5fee789dbac9ad6317dfacd191c961a48f7d627090ca31d71e73c",
  "agente": "",
  "versao_diretrizes": "1.0",
  "criado_em": "2026-09-02T17:55:54Z",
  "atualizado_em": "2026-09-02T17:55:54Z"
}
